<?xml version="1.0" encoding="UTF-8"?>
<ns1:Puzzle Version="3" Title="" XSize="1" YSize="1" ZSize="2" AllowedFails="1" xmlns:xsi="http://www.w3.org/2001/XMLSchema-instance" xmlns:ns1="http://Rittai.Picross" xsi:schemaLocation="http://Rittai.Picross file:/Users/Ian/workspace/Personal/Netbeans/Rittai%20Picross/src/js/Puzzle.xsd">
    <ns1:PaintColor>
        <ns1:r>0</ns1:r>
        <ns1:g>0</ns1:g>
        <ns1:b>1</ns1:b>
        <ns1:a>1</ns1:a>
    </ns1:PaintColor>
    <ns1:Cubes>
        <ns1:Cube Solid="false">
            <ns1:FinishedColor>
                <ns1:r>1</ns1:r>
                <ns1:g>1</ns1:g>
                <ns1:b>1</ns1:b>
                <ns1:a>1</ns1:a>
            </ns1:FinishedColor>
        </ns1:Cube>
        <ns1:Cube Solid="true">
            <ns1:FinishedColor>
                <ns1:r>1</ns1:r>
                <ns1:g>1</ns1:g>
                <ns1:b>1</ns1:b>
                <ns1:a>1</ns1:a>
            </ns1:FinishedColor>
        </ns1:Cube>
    </ns1:Cubes>
</ns1:Puzzle>